{
  "$schema": "http://json-schema.org/draft-07/schema#",
  "additionalProperties": false,
  "$id": "https://github.com/Bobikobi/GAME/schema/json/kit.schema.json",
  "type": "object",
  "required": [
    "format",
    "id",
    "title",
    "creator",
    "type",
    "kit"
  ],
  "properties": {
    "$schema": {
      "type": "string"
    },
    "format": {
      "description": "Format version of this file.",
      "const": 1,
      "type": "number"
    },
    "id": {
      "pattern": "^[a-z0-9_-]+/[a-z0-9_-]+$",
      "maxLength": 80,
      "description": "Stable id \"creator/name\": lowercase letters, digits, \"_\" and \"-\". Never reused once merged.",
      "type": "string"
    },
    "title": {
      "minLength": 1,
      "maxLength": 40,
      "type": "string"
    },
    "creator": {
      "pattern": "^[a-z0-9_-]+$",
      "maxLength": 39,
      "description": "GitHub handle, lowercase.",
      "type": "string"
    },
    "description": {
      "minLength": 1,
      "maxLength": 240,
      "type": "string"
    },
    "ai_tools": {
      "maxItems": 8,
      "description": "AI tools used to make this file or its art. Required when any were used.",
      "type": "array",
      "items": {
        "minLength": 1,
        "maxLength": 60,
        "type": "string"
      }
    },
    "items": {
      "maxItems": 40,
      "type": "array",
      "items": {
        "additionalProperties": false,
        "type": "object",
        "required": [
          "id",
          "name",
          "kind",
          "rarity",
          "sprite"
        ],
        "properties": {
          "id": {
            "pattern": "^[a-z0-9_-]+/[a-z0-9_-]+$",
            "maxLength": 80,
            "description": "Stable id \"creator/name\": lowercase letters, digits, \"_\" and \"-\". Never reused once merged.",
            "type": "string"
          },
          "name": {
            "minLength": 1,
            "maxLength": 40,
            "type": "string"
          },
          "description": {
            "minLength": 1,
            "maxLength": 240,
            "type": "string"
          },
          "kind": {
            "anyOf": [
              {
                "const": "material",
                "type": "string"
              },
              {
                "const": "food",
                "type": "string"
              },
              {
                "const": "tool",
                "type": "string"
              },
              {
                "const": "fragment",
                "type": "string"
              },
              {
                "const": "treasure",
                "type": "string"
              }
            ]
          },
          "rarity": {
            "description": "Declared rarity. The check compares it with the rarity computed from the data.",
            "anyOf": [
              {
                "const": "common",
                "type": "string"
              },
              {
                "const": "uncommon",
                "type": "string"
              },
              {
                "const": "rare",
                "type": "string"
              },
              {
                "const": "legendary",
                "type": "string"
              }
            ]
          },
          "class": {
            "description": "A base class (plant, wood, fibre, ...) or the id of a class an extension declares under one of them.",
            "anyOf": [
              {
                "const": "plant",
                "type": "string"
              },
              {
                "const": "wood",
                "type": "string"
              },
              {
                "const": "fibre",
                "type": "string"
              },
              {
                "const": "stone",
                "type": "string"
              },
              {
                "const": "clay",
                "type": "string"
              },
              {
                "const": "mineral",
                "type": "string"
              },
              {
                "const": "metal",
                "type": "string"
              },
              {
                "const": "animal",
                "type": "string"
              },
              {
                "const": "meal",
                "type": "string"
              },
              {
                "const": "tool",
                "type": "string"
              },
              {
                "const": "garment",
                "type": "string"
              },
              {
                "const": "jewelry",
                "type": "string"
              },
              {
                "const": "relic",
                "type": "string"
              },
              {
                "pattern": "^[a-z0-9_-]+/[a-z0-9_-]+$",
                "maxLength": 80,
                "description": "Stable id \"creator/name\": lowercase letters, digits, \"_\" and \"-\". Never reused once merged.",
                "type": "string"
              }
            ]
          },
          "family": {
            "pattern": "^[a-z0-9_-]+$",
            "maxLength": 24,
            "description": "A group inside the class, for example \"berry\" for every berry. Open: any lowercase word.",
            "type": "string"
          },
          "tags": {
            "maxItems": 8,
            "uniqueItems": true,
            "description": "Open words that describe it, for example \"sweet\" or \"night\".",
            "type": "array",
            "items": {
              "pattern": "^[a-z0-9_-]+$",
              "maxLength": 24,
              "description": "A lowercase word.",
              "type": "string"
            }
          },
          "tier": {
            "minimum": 1,
            "maximum": 20,
            "description": "How advanced it is, from 1. The rarity says how often it appears; the tier says how far up the ladder it is. A tool has the tier of its \"tool\".",
            "type": "integer"
          },
          "sprite": {
            "pattern": "^[a-z0-9_-]+/[a-z0-9_-]+:[a-z0-9_/-]+$",
            "maxLength": 120,
            "description": "A frame of an art kit: \"<kit id>:<frame name>\", for example \"core/base-kit:items/berry\".",
            "type": "string"
          },
          "food": {
            "additionalProperties": false,
            "type": "object",
            "required": [
              "satiety"
            ],
            "properties": {
              "satiety": {
                "minimum": 1,
                "maximum": 100,
                "description": "Satiety points restored when eaten (the meter holds 100 at the start).",
                "type": "integer"
              }
            }
          },
          "tool": {
            "additionalProperties": false,
            "type": "object",
            "required": [
              "kind",
              "tier",
              "uses"
            ],
            "properties": {
              "kind": {
                "anyOf": [
                  {
                    "const": "basket",
                    "type": "string"
                  },
                  {
                    "const": "trowel",
                    "type": "string"
                  },
                  {
                    "const": "axe",
                    "type": "string"
                  }
                ]
              },
              "tier": {
                "minimum": 1,
                "maximum": 5,
                "description": "Better tools work faster. The calculator clamps the total.",
                "type": "integer"
              },
              "uses": {
                "minimum": 1,
                "maximum": 1000,
                "description": "The tool wears out after this many uses.",
                "type": "integer"
              }
            }
          },
          "fragment": {
            "additionalProperties": false,
            "description": "A found scrap that teaches a recipe.",
            "type": "object",
            "required": [
              "unlocks"
            ],
            "properties": {
              "unlocks": {
                "pattern": "^[a-z0-9_-]+/[a-z0-9_-]+$",
                "maxLength": 80,
                "description": "Stable id \"creator/name\": lowercase letters, digits, \"_\" and \"-\". Never reused once merged.",
                "type": "string"
              }
            }
          },
          "wear": {
            "additionalProperties": false,
            "description": "Something the character wears (DECISIONS.md, 2026-10-09: the upgrade). A worn item stays in the bag.",
            "type": "object",
            "required": [
              "slot"
            ],
            "properties": {
              "slot": {
                "description": "Where it is worn: head, top, legs (trousers), outfit (takes the top and the legs), feet, jewelry (two places) or hand (a tool).",
                "anyOf": [
                  {
                    "const": "head",
                    "type": "string"
                  },
                  {
                    "const": "top",
                    "type": "string"
                  },
                  {
                    "const": "legs",
                    "type": "string"
                  },
                  {
                    "const": "outfit",
                    "type": "string"
                  },
                  {
                    "const": "feet",
                    "type": "string"
                  },
                  {
                    "const": "jewelry",
                    "type": "string"
                  },
                  {
                    "const": "hand",
                    "type": "string"
                  }
                ]
              },
              "look": {
                "description": "A look: worn on the look layer over the work clothes. It shows and counts for nothing, so it has no effects and no set.",
                "type": "boolean"
              },
              "effects": {
                "minItems": 1,
                "maxItems": 2,
                "description": "Small bonuses while it is worn on the work layer. Two at most, each effect once.",
                "type": "array",
                "items": {
                  "additionalProperties": false,
                  "type": "object",
                  "required": [
                    "effect",
                    "value"
                  ],
                  "properties": {
                    "effect": {
                      "description": "What a worn item helps: gathering, digging or crafting speed, the craft chance, or rare finds.",
                      "anyOf": [
                        {
                          "const": "gather_speed_pct",
                          "type": "string"
                        },
                        {
                          "const": "dig_speed_pct",
                          "type": "string"
                        },
                        {
                          "const": "craft_speed_pct",
                          "type": "string"
                        },
                        {
                          "const": "craft_chance_pct",
                          "type": "string"
                        },
                        {
                          "const": "rare_find_pct",
                          "type": "string"
                        }
                      ]
                    },
                    "value": {
                      "minimum": 1,
                      "maximum": 100,
                      "description": "Percent, at most the cap of the item's tier (params.wear_effect_max_pct).",
                      "type": "integer"
                    }
                  }
                }
              },
              "set": {
                "pattern": "^[a-z0-9_-]+/[a-z0-9_-]+$",
                "maxLength": 80,
                "description": "A set of one creator: when every piece of it is worn, their effects grow by params.wear_set_bonus_pct.",
                "type": "string"
              }
            }
          },
          "premium_later": {
            "description": "Marks a look that may also be sold for premium currency once stage 6 brings it. Only a look item with no effect may carry it, and it stays obtainable in the game (DECISIONS.md, 2026-10-09).",
            "type": "boolean"
          }
        }
      }
    },
    "classes": {
      "maxItems": 10,
      "description": "Classes of your own, each under one base class.",
      "type": "array",
      "items": {
        "additionalProperties": false,
        "description": "A class of your own, declared under one base class. Every rule written for the base class holds for it.",
        "type": "object",
        "required": [
          "id",
          "name",
          "base"
        ],
        "properties": {
          "id": {
            "pattern": "^[a-z0-9_-]+/[a-z0-9_-]+$",
            "maxLength": 80,
            "description": "Stable id \"creator/name\": lowercase letters, digits, \"_\" and \"-\". Never reused once merged.",
            "type": "string"
          },
          "name": {
            "minLength": 1,
            "maxLength": 40,
            "type": "string"
          },
          "base": {
            "description": "plant (leaves, herbs, berries, fruit, roots, mushrooms), wood, fibre (reeds, grass, thread, cloth), stone, clay (clay, sand, pottery, brick), mineral (crystals, gems, salt, ore), metal (waits for its discovery), animal (feathers, wool, hide, bone), meal (cooked food), tool, garment (worn clothes), jewelry, relic (old things from the ruins).",
            "anyOf": [
              {
                "const": "plant",
                "type": "string"
              },
              {
                "const": "wood",
                "type": "string"
              },
              {
                "const": "fibre",
                "type": "string"
              },
              {
                "const": "stone",
                "type": "string"
              },
              {
                "const": "clay",
                "type": "string"
              },
              {
                "const": "mineral",
                "type": "string"
              },
              {
                "const": "metal",
                "type": "string"
              },
              {
                "const": "animal",
                "type": "string"
              },
              {
                "const": "meal",
                "type": "string"
              },
              {
                "const": "tool",
                "type": "string"
              },
              {
                "const": "garment",
                "type": "string"
              },
              {
                "const": "jewelry",
                "type": "string"
              },
              {
                "const": "relic",
                "type": "string"
              }
            ]
          },
          "description": {
            "minLength": 1,
            "maxLength": 240,
            "type": "string"
          }
        }
      }
    },
    "type": {
      "const": "kit",
      "type": "string"
    },
    "kit": {
      "additionalProperties": false,
      "type": "object",
      "required": [
        "sprites"
      ],
      "properties": {
        "palette": {
          "minItems": 2,
          "maxItems": 32,
          "description": "Only the core kit sets the palette. Every sprite of every kit must use these colors.",
          "type": "array",
          "items": {
            "pattern": "^#[0-9a-f]{6}$",
            "type": "string"
          }
        },
        "sprites": {
          "description": "Sprite name (group/name) to its PNG. Groups: tiles, items, chars, props, ui.",
          "type": "object",
          "patternProperties": {
            "^[a-z0-9_-]+/[a-z0-9_/-]+$": {
              "additionalProperties": false,
              "type": "object",
              "required": [
                "file",
                "w",
                "h"
              ],
              "properties": {
                "file": {
                  "pattern": "^[a-z0-9_/-]+\\.png$",
                  "description": "PNG next to this file.",
                  "type": "string"
                },
                "w": {
                  "minimum": 8,
                  "maximum": 64,
                  "description": "Frame width in pixels. tiles/ and items/ are 16, chars/ are 16.",
                  "type": "integer"
                },
                "h": {
                  "minimum": 8,
                  "maximum": 64,
                  "description": "Frame height in pixels. tiles/ and items/ are 16, chars/ are 24.",
                  "type": "integer"
                },
                "frames": {
                  "minimum": 1,
                  "maximum": 16,
                  "description": "Animation frames laid side by side. Default 1.",
                  "type": "integer"
                }
              }
            }
          }
        }
      }
    }
  }
}
