{
  "format": 1,
  "type": "kit",
  "id": "ceosisrael/kit",
  "title": "CeosIsrael's kit art",
  "creator": "ceosisrael",
  "ai_tools": [
    "Claude (Anthropic)",
    "Qwen-Image 2512 (kit:gen, kaggle drawer)"
  ],
  "kit": {
    "sprites": {
      "props/fig_bush": {
        "file": "props/fig_bush.png",
        "w": 128,
        "h": 256,
        "density": 4,
        "ramps": [
          "green",
          "plum",
          "bark"
        ],
        "scale": 3.25,
        "source": {
          "spec": "tools/src/art/trees.ts",
          "manifest": "tools/kit-gen/rich-wave.manifest.jsonl:161"
        },
        "frames": 2
      },
      "props/fig_bush_empty": {
        "file": "props/fig_bush_empty.png",
        "w": 128,
        "h": 256,
        "density": 4,
        "ramps": [
          "green",
          "bark"
        ],
        "scale": 3.25,
        "source": {
          "spec": "tools/src/art/trees.ts",
          "manifest": "tools/kit-gen/rich-wave.manifest.jsonl:162"
        },
        "frames": 2
      },
      "items/fig": {
        "file": "items/fig.png",
        "w": 64,
        "h": 64,
        "density": 4,
        "ramps": [
          "plum",
          "red",
          "green"
        ]
      },
      "items/travellers_cap": {
        "file": "items/travellers_cap.png",
        "w": 64,
        "h": 64,
        "density": 4,
        "ramps": [
          "wood",
          "moss",
          "rust"
        ]
      }
    }
  }
}
